folder,game,VGDCName,TvTName,tropeName,subverted,tropeNotes,tropeURL
../data/FinalFantasy/FFVII/,Final Fantasy VII,Sephiroth,Sephiroth,Still Wearing the Old Colors,0," [Still Wearing the Old Colors](/pmwiki/pmwiki.php/Main/StillWearingTheOldColors): Sephiroth is still dressed in his SOLDIER outfit long after he's gone rogue. Though he assumes the monstrous forms of Bizarro and Safer Sephiroth, his humanoid form is always wearing that costume, even after coming back from the dead in *Advent Children*.",/pmwiki/pmwiki.php/Main/StillWearingTheOldColors
../data/FinalFantasy/FFVII/,Final Fantasy VII,Sephiroth,Sephiroth,The Stoic,0, [The Stoic](/pmwiki/pmwiki.php/Main/TheStoic): He always has a calm tone and never raises his voice. Even in battle he never once grunted during his fights with Cloud and AVALANCHE.,/pmwiki/pmwiki.php/Main/TheStoic
../data/FinalFantasy/FFVII/,Final Fantasy VII,Sephiroth,Sephiroth,Strong Family Resemblance,0," [Strong Family Resemblance](/pmwiki/pmwiki.php/Main/StrongFamilyResemblance): He looks like  (SPOILER) a male version of his biological mother, Lucrecia, albeit with Jenova's hair color. ",/pmwiki/pmwiki.php/Main/StrongFamilyResemblance
../data/FinalFantasy/FFVII/,Final Fantasy VII,Sephiroth,Sephiroth,Sugar-and-Ice Personality,0," [Sugar-and-Ice Personality](/pmwiki/pmwiki.php/Main/SugarAndIcePersonality): *Crisis Core* gives him this personality pre-madness — he's composed, aloof, and professional, but he's also capable of being loyal and worried about his friends. He can also be pretty considerate, as evidenced by Zack once the two start to become friends. Comes complete with several [Pet the Dog](/pmwiki/pmwiki.php/Main/PetTheDog) moments, such as [the end of Chapter 7<img height=""12"" src=""https://static.tvtropes.org/pmwiki/pub/external_link.gif"" style=""border:none;"" width=""12""/>](https://www.youtube.com/watch?v=feQQ_OUqbXE), when Sephiroth informs Zack that Genesis copies have been sighted in Midgar, particularly noting their presence in the slums, and gives him permission to return to the city because he knows Zack is worried about Aerith and wants to see her.",/pmwiki/pmwiki.php/Main/SugarAndIcePersonality
../data/FinalFantasy/FFVII/,Final Fantasy VII,Sephiroth,Sephiroth,Super-Persistent Predator,0," [Super-Persistent Predator](/pmwiki/pmwiki.php/Main/SuperPersistentPredator): Ever since Cloud first killed him in Nibelheim, Sephiroth's sheer hatred of his [Arch-Enemy](/pmwiki/pmwiki.php/Main/ArchEnemy) allowed him to preserve his mind in the Lifestream and reconstruct himself using Jenova cells, and he does it again and again each time he's re-killed. So long as Cloud stays [The Hero](/pmwiki/pmwiki.php/Main/TheHero) that slew him, Sephiroth will **never** stop hunting him. This even applies to *crossovers with other games* - whenever Cloud shows up, you can bet that Sephiroth won't be far behind.",/pmwiki/pmwiki.php/Main/SuperPersistentPredator
../data/FinalFantasy/FFVII/,Final Fantasy VII,Sephiroth,Sephiroth,Super Prototype,0," [Super Prototype](/pmwiki/pmwiki.php/Main/SuperPrototype): As the very first SOLDIER, Sephiroth was created with a different procedure than the rest: he wasn't just injected with Jenova cells, he was injected while in the womb and grew and merged with them as he developed.",/pmwiki/pmwiki.php/Main/SuperPrototype
../data/FinalFantasy/FFVII/,Final Fantasy VII,Sephiroth,Sephiroth,Super-Reflexes,0," [Super-Reflexes](/pmwiki/pmwiki.php/Main/SuperReflexes): Not only he has insane strength but he is also very quick on the draw. In *Crisis Core*, when Zack held him at swordpoint, he quickly threw him off guard and off the platform they were standing. He also calmly deflected a fireball thrown by Genesis which caught even Zack off-guard.",/pmwiki/pmwiki.php/Main/SuperReflexes
../data/FinalFantasy/FFVII/,Final Fantasy VII,Sephiroth,Sephiroth,Sword Beam,0," [Sword Beam](/pmwiki/pmwiki.php/Main/SwordBeam): In *Crisis Core* and the *Dissidia* series, Sephiroth can fire waves of energy from the Masamune's blade.",/pmwiki/pmwiki.php/Main/SwordBeam
../data/FinalFantasy/FFVII/,Final Fantasy VII,Sephiroth,Sephiroth,Tragic Villain,0," [Tragic Villain](/pmwiki/pmwiki.php/Main/TragicVillain): Sephiroth may be evil to the point of making it look cool, but at the end of it all he's still a deeply disturbed man who was lied to all his life about his origins, deprived of any normal familial care &amp; experimented on since his conception, and raised by some of the most morally bankrupt caretakers one could possibly have just so he could be used as a weapon. Not only that, but even after proving himself as a highly revered individual in SOLDIER, it forced him into conflict with some of the only people he was ever able to make friends with, and he lost all of them one way or another. If he'd had a better upbringing with more supportive people and was allowed to understand what he is, he might have never had his [Start of Darkness](/pmwiki/pmwiki.php/Main/StartOfDarkness) to begin with.",/pmwiki/pmwiki.php/Main/TragicVillain
../data/FinalFantasy/FFVII/,Final Fantasy VII,Sephiroth,Sephiroth,Tranquil Fury,0," [Tranquil Fury](/pmwiki/pmwiki.php/Main/TranquilFury): Opposite of Cloud, who let's out fierce [Hot-Blooded](/pmwiki/pmwiki.php/Main/HotBlooded) yells, Sephiroth is always calm, it's eerie. His [Villain Song](/pmwiki/pmwiki.php/Main/VillainSong) ""One-Winged Angel"" even portraying Sephiroth as if he was ""burning inside with violent anger""",/pmwiki/pmwiki.php/Main/TranquilFury
../data/FinalFantasy/FFVII/,Final Fantasy VII,Sephiroth,Sephiroth,Trauma Conga Line,0," [Trauma Conga Line](/pmwiki/pmwiki.php/Main/TraumaCongaLine): *Crisis Core* explains his [Start of Darkness](/pmwiki/pmwiki.php/Main/StartOfDarkness) was the result of this. His two closest friends (implied to be his only friends at all, aside from Zack) go rogue and rebel against Shinra, he's the one usually sent out to fight their forces, he finds out the two are [Super-Soldier](/pmwiki/pmwiki.php/Main/SuperSoldier) [Humanoid Abominations](/pmwiki/pmwiki.php/Main/HumanoidAbomination) experiments created by Shinra, and Shinra is implied to never show any concern for his feelings about any of this. By the time the Nibelheim mission comes around a year or two since the outbreak of the Genesis War, Sephiroth is considering retiring... then he finds out he's also a genetic experiment created by Shinra, and the other two were basically prototypes for him. While Sephiroth snapped at Nibelheim, it was really just the last spark in a long, slow burn of his sanity.",/pmwiki/pmwiki.php/Main/TraumaCongaLine
../data/FinalFantasy/FFVII/,Final Fantasy VII,Sephiroth,Sephiroth,Tyke-Bomb,0, [Tyke-Bomb](/pmwiki/pmwiki.php/Main/Tykebomb): He was genetically altered in the womb and raised pretty much from birth to be Shinra's perfect warrior.,/pmwiki/pmwiki.php/Main/Tykebomb
../data/FinalFantasy/FFVII/,Final Fantasy VII,Sephiroth,Sephiroth,The Ugly Guy's Hot Daughter,0," [The Ugly Guy's Hot Daughter](/pmwiki/pmwiki.php/Main/TheUglyGuysHotDaughter): Played with. He definitely looks much more attractive than his father, who is repulsive, but his mother is quite beautiful.",/pmwiki/pmwiki.php/Main/TheUglyGuysHotDaughter
../data/FinalFantasy/FFVII/,Final Fantasy VII,Sephiroth,Sephiroth,Undying Loyalty,0," [Undying Loyalty](/pmwiki/pmwiki.php/Main/UndyingLoyalty): To pretty much anyone he gets particularly close to, like Genesis, Angeal and Zack. But at the same time, he's deeply loyal to SOLDIER and Shinra. When Genesis wages a one-man war against SOLDIER and takes Angeal with him, his loyalties become torn - though he does admit to Zack that he's at least considered betraying Shinra himself. This aspect of his character is pretty much gone after he loses his mind.",/pmwiki/pmwiki.php/Main/UndyingLoyalty
../data/FinalFantasy/FFVII/,Final Fantasy VII,Sephiroth,Sephiroth,Unusable Enemy Equipment,0," [Unusable Enemy Equipment](/pmwiki/pmwiki.php/Main/UnusableEnemyEquipment): While he's pointedly *not* an enemy at the time, the game goes out of its way during the Nibelheim flashback to keep your hands off his fully leveled materia with its late-game magic while he's a [Guest-Star Party Member](/pmwiki/pmwiki.php/Main/GuestStarPartyMember). Attempting to remove or transfer any of his materia (or the Masamune, for that matter) while he's in the party will earn a stern ""..."" from Sephiroth.<ul>
-   Sephiroth is also controlled by the AI the entire time he's in the party, making all his equipment *doubly* unusable.</ul>",/pmwiki/pmwiki.php/Main/UnusableEnemyEquipment
../data/FinalFantasy/FFVII/,Final Fantasy VII,Sephiroth,Sephiroth,Villain Song,0," [Villain Song](/pmwiki/pmwiki.php/Main/VillainSong): ""One-Winged Angel"" is probably the most famous example of this trope in video games, even though he's not the one doing the singing. Both versions are sung by a Latin choir with lyrics from the *Carmina Burana*, portraying Sephiroth as if he was ""burning inside with violent anger"". The *Advent Children* version, however, appears to be sung from Jenova's point of view, encouraging Sephiroth to not remain a memory.",/pmwiki/pmwiki.php/Main/VillainSong
../data/FinalFantasy/FFVII/,Final Fantasy VII,Sephiroth,Sephiroth,The Virus,0," [The Virus](/pmwiki/pmwiki.php/Main/TheVirus): Is the cause of Geostigma in *Advent Children*; the virus was created through his tainting of the Lifestream from within. After he first noticed he could do it, [he kept doing it for the sheer enjoyment of tarnishing everything](/pmwiki/pmwiki.php/Main/ForTheEvulz). There are even hints he had been further breaking Cloud's psyche via Cloud's Geostigma infection. Once he was infected, he let Sephiroth into his mind again.",/pmwiki/pmwiki.php/Main/TheVirus
../data/FinalFantasy/FFVII/,Final Fantasy VII,Sephiroth,Sephiroth,Walking Shirtless Scene,0," [Walking Shirtless Scene](/pmwiki/pmwiki.php/Main/WalkingShirtlessScene): The front of his jacket is always open, exposing his chest. During his [Final Boss](/pmwiki/pmwiki.php/Main/FinalBoss) battle with Cloud he sheds the trenchcoat, and attacks him wearing only his pants and boots. Heads straight into [Fan Disservice](/pmwiki/pmwiki.php/Main/FanDisservice) when Cloud beats him and we see him like this again now covered in blood.",/pmwiki/pmwiki.php/Main/WalkingShirtlessScene
../data/FinalFantasy/FFVII/,Final Fantasy VII,Sephiroth,Sephiroth,Where I Was Born and Razed,0," [Where I Was Born and Razed](/pmwiki/pmwiki.php/Main/WhereIWasBornAndRazed): Although Sephiroth himself doesn't seem to realize it (he mentions that he ""has no hometown""), it is implied in the games, and confirmed via <img class=""trivia1 rounded"" src=""/images/article-hreficon-trivia.png"" title=""This example contains a TRIVIA entry. It should be moved to the TRIVIA tab.""/>[Word of God](/pmwiki/pmwiki.php/Main/WordOfGod) and [creation materials](/pmwiki/pmwiki.php/Main/AllThereInTheManual), that Sephiroth was born in Nibelheim, the very same place he ended up burning to the ground.",/pmwiki/pmwiki.php/Main/WhereIWasBornAndRazed
../data/FinalFantasy/FFVII/,Final Fantasy VII,Sephiroth,Sephiroth,"White Hair, Black Heart",1," [White Hair, Black Heart](/pmwiki/pmwiki.php/Main/WhiteHairBlackHeart): Despite being one of the most famous examples, Sephiroth was actually a subversion when he first appeared. He was not effeminate in his original appearance (one of his defining traits being his incredibly badass combat prowess) and, before going mad, his [stoicism](/pmwiki/pmwiki.php/Main/TheStoic) outweighed any [Sugar-and-Ice Personality](/pmwiki/pmwiki.php/Main/SugarAndIcePersonality) traits. The later games tend to play the trope straighter, with his white hair emphasizing his villainous nature and connection to Jenova.",/pmwiki/pmwiki.php/Main/WhiteHairBlackHeart
../data/FinalFantasy/FFVII/,Final Fantasy VII,Sephiroth,Sephiroth,Winged Humanoid,0, [Winged Humanoid](/pmwiki/pmwiki.php/Main/WingedHumanoid): Sephiroth can manifest a single black angel wing while fighting.,/pmwiki/pmwiki.php/Main/WingedHumanoid
../data/FinalFantasy/FFVII/,Final Fantasy VII,Sephiroth,Sephiroth,Wings Do Nothing,0," [Wings Do Nothing](/pmwiki/pmwiki.php/Main/WingsDoNothing): Averted. As Safer Sephiroth, the wing in his right hand is used as his standard attack. He can also use the wings in his lower body to rise up in the air, making him unreachable to melee fighters.",/pmwiki/pmwiki.php/Main/WingsDoNothing
../data/FinalFantasy/FFVII/,Final Fantasy VII,Weiss the Immaculate,Weiss the Immaculate,Ambiguously Bi,0, [Ambiguously Bi](/pmwiki/pmwiki.php/Main/AmbiguouslyBi): He flirts a bit with Rosso in their battle yet there is some [Incest Subtext](/pmwiki/pmwiki.php/Main/IncestSubtext) between he and Nero.,/pmwiki/pmwiki.php/Main/AmbiguouslyBi
../data/FinalFantasy/FFVII/,Final Fantasy VII,Weiss the Immaculate,Weiss the Immaculate,Ambiguously Evil,0," [Ambiguously Evil](/pmwiki/pmwiki.php/Main/AmbiguouslyEvil):  (SPOILER) When it comes to the real Weiss.  There is definitely something off about him, judging by the online scenes, yet how evil he is remains unknown.",/pmwiki/pmwiki.php/Main/AmbiguouslyEvil
../data/FinalFantasy/FFVII/,Final Fantasy VII,Weiss the Immaculate,Weiss the Immaculate,Anime Hair,0, [Anime Hair](/pmwiki/pmwiki.php/Main/AnimeHair): He outdoes even Cloud with his massive sea of silver spikes.,/pmwiki/pmwiki.php/Main/AnimeHair
../data/FinalFantasy/FFVII/,Final Fantasy VII,Weiss the Immaculate,Weiss the Immaculate,Bad Boss,0," [Bad Boss](/pmwiki/pmwiki.php/Main/BadBoss): Downplayed when it comes to (SPOILER) the real Weiss.  During his rebellion in Online mode, he fights in order to get the other Tsviets free, but he clearly does it to rule over them all and has no problem to simply let them die if they are of no use or to kill them if they are too weak. It is shown that everyone in Deepground is scared of him due to his power. In *Opera Omnia*, he values his Tsviets' strenght as well as their unity but Shelke thinks he has no real feelings for them.",/pmwiki/pmwiki.php/Main/BadBoss
../data/FinalFantasy/FFVII/,Final Fantasy VII,Weiss the Immaculate,Weiss the Immaculate,Bait the Dog,0, [Bait the Dog](/pmwiki/pmwiki.php/Main/BaitTheDog): Weiss was supportive of the player during the online mode.  (SPOILER) It doesn't prevent him to let it die. ,/pmwiki/pmwiki.php/Main/BaitTheDog
../data/FinalFantasy/FFVII/,Final Fantasy VII,Weiss the Immaculate,Weiss the Immaculate,BFS,0, [BFS](/pmwiki/pmwiki.php/Main/BFS): He wields a pair of *nodachi* when confronting Vincent for the last time.,/pmwiki/pmwiki.php/Main/BFS
../data/FinalFantasy/FFVII/,Final Fantasy VII,Weiss the Immaculate,Weiss the Immaculate,Big Bad,0," [Big Bad](/pmwiki/pmwiki.php/Main/BigBad): In *Dirge of Cerberus*.  (SPOILER) Except not really. It's revealed that he was just a host to Hojo, the true Big Bad. ",/pmwiki/pmwiki.php/Main/BigBad
../data/FinalFantasy/FFVII/,Final Fantasy VII,Weiss the Immaculate,Weiss the Immaculate,Big Brother Instinct,0, [Big Brother Instinct](/pmwiki/pmwiki.php/Main/BigBrotherInstinct): He's *very* close to his little brother Nero.,/pmwiki/pmwiki.php/Main/BigBrotherInstinct
../data/FinalFantasy/FFVII/,Final Fantasy VII,Weiss the Immaculate,Weiss the Immaculate,Blood Knight,0, [Blood Knight](/pmwiki/pmwiki.php/Main/BloodKnight): He just lives for the sake of fighting strong people and killing. *Opera Omnia* shows he would not follow anyone who is weaker than he.,/pmwiki/pmwiki.php/Main/BloodKnight
../data/FinalFantasy/FFVII/,Final Fantasy VII,Weiss the Immaculate,Weiss the Immaculate,Computer Virus,0, [Computer Virus](/pmwiki/pmwiki.php/Main/ComputerVirus): It's how  (SPOILER) Hojo infected him and killed him. ,/pmwiki/pmwiki.php/Main/ComputerVirus
../data/FinalFantasy/FFVII/,Final Fantasy VII,Weiss the Immaculate,Weiss the Immaculate,Dead to Begin With,0, [Dead to Begin With](/pmwiki/pmwiki.php/Main/DeadToBeginWith): He's dead at the beginning of the game; the goal of the other Tsviets is to revive him as  (SPOILER) the vessel for Omega. ,/pmwiki/pmwiki.php/Main/DeadToBeginWith
../data/FinalFantasy/FFVII/,Final Fantasy VII,Weiss the Immaculate,Weiss the Immaculate,Disney Death,0, [Disney Death](/pmwiki/pmwiki.php/Main/DisneyDeath): He may not be dead at the end of the game.  (SPOILER) The secret ending has us [Left Hanging](/pmwiki/pmwiki.php/Main/LeftHanging). ,/pmwiki/pmwiki.php/Main/DisneyDeath
../data/FinalFantasy/FFVII/,Final Fantasy VII,Weiss the Immaculate,Weiss the Immaculate,Dual Wielding,0," [Dual Wielding](/pmwiki/pmwiki.php/Main/DualWielding): He wields two gunblades, Heaven and Earth. After losing them, he takes up a pair of *nodachi*.",/pmwiki/pmwiki.php/Main/DualWielding
../data/FinalFantasy/FFVII/,Final Fantasy VII,Weiss the Immaculate,Weiss the Immaculate,The Emperor,0," [The Emperor](/pmwiki/pmwiki.php/Main/TheEmperor): He is the supreme commander of the Deepground forces, and his title in the original Japanese is Emperor.",/pmwiki/pmwiki.php/Main/TheEmperor
../data/FinalFantasy/FFVII/,Final Fantasy VII,Weiss the Immaculate,Weiss the Immaculate,Even Evil Has Loved Ones,0," [Even Evil Has Loved Ones](/pmwiki/pmwiki.php/Main/EvenEvilHasLovedOnes): *Dirge of Cerberus* as well as *Opera Omnia* confirms he loves Nero as much as Nero loves him.  (SPOILER) He did not really care about the plan. He fused with Omega to get rid of Hojo and also to fly away with Nero in order to be together. In *Opera Omnia*, he told his personal story to Sephiroth and said that without Nero he would not have made it and also feels incomplete without him. When he recovers his memories he is extremely upset about having forgotten about him out of all people and misses him terribly. ",/pmwiki/pmwiki.php/Main/EvenEvilHasLovedOnes
../data/FinalFantasy/FFVII/,Final Fantasy VII,Weiss the Immaculate,Weiss the Immaculate,Even the Guys Want Him,0," [Even the Guys Want Him](/pmwiki/pmwiki.php/Main/EvenTheGuysWantHim): Azul is clearly his biggest fanboy to the point he dies while screaming ""Hail Weiss"" before laughing. [Incest Subtext](/pmwiki/pmwiki.php/Main/IncestSubtext) also implies Nero loves him a bit too much for a brother.",/pmwiki/pmwiki.php/Main/EvenTheGuysWantHim
../data/FinalFantasy/FFVII/,Final Fantasy VII,Weiss the Immaculate,Weiss the Immaculate,Evil Counterpart,0," [Evil Counterpart](/pmwiki/pmwiki.php/Main/EvilCounterpart): To Vincent. Both are hosts of powerful ancient beings with Vincent as the host of Chaos, while Weiss is the host of Omega, but that is where the similarities end. Vincent was a once a normal Turk who became a host of Chaos by being experimented on, While Weiss was a former member of SOLDIER who became the leader of Deepground and the host of Omega.",/pmwiki/pmwiki.php/Main/EvilCounterpart
../data/FinalFantasy/FFVII/,Final Fantasy VII,Weiss the Immaculate,Weiss the Immaculate,Evil Laugh,0," [Evil Laugh](/pmwiki/pmwiki.php/Main/EvilLaugh): He does it a lot.  (SPOILER) Being possessed by Hojo had little impact on it, the online mode shows it's just him. ",/pmwiki/pmwiki.php/Main/EvilLaugh
../data/FinalFantasy/FFVII/,Final Fantasy VII,Weiss the Immaculate,Weiss the Immaculate,Evil Versus Evil,0, [Evil Versus Evil](/pmwiki/pmwiki.php/Main/EvilVersusEvil): His conflict against Restrictor during his revolt at Deepground. Both are violent and atrocious people.,/pmwiki/pmwiki.php/Main/EvilVersusEvil
../data/FinalFantasy/FFVII/,Final Fantasy VII,Weiss the Immaculate,Weiss the Immaculate,Final Boss,0," [Final Boss](/pmwiki/pmwiki.php/Main/FinalBoss): He's this for *Dirge of Cerebus*, and by extension of Compilation of Final Fantasy VII as a whole (or the original continuity at least).",/pmwiki/pmwiki.php/Main/FinalBoss
../data/FinalFantasy/FFVII/,Final Fantasy VII,Weiss the Immaculate,Weiss the Immaculate,Grand Theft Me,0," [Grand Theft Me](/pmwiki/pmwiki.php/Main/GrandTheftMe): He seizes control of  (SPOILER) Omega's body  to fight Vincent.  (SPOILER) Also a victim of it himself, losing his body to Hojo. ",/pmwiki/pmwiki.php/Main/GrandTheftMe
../data/FinalFantasy/FFVII/,Final Fantasy VII,Weiss the Immaculate,Weiss the Immaculate,Hidden Depths,0," [Hidden Depths](/pmwiki/pmwiki.php/Main/HiddenDepths): Nero describes Weiss as being the only being who'd ever loved him. While their relationship is mostly viewed from Nero's point of view, the fact that Nero is willing to sacrifice himself for him displays another side from the [Evil Overlord](/pmwiki/pmwiki.php/Main/EvilOverlord) in Deepground.",/pmwiki/pmwiki.php/Main/HiddenDepths
../data/FinalFantasy/FFVII/,Final Fantasy VII,Weiss the Immaculate,Weiss the Immaculate,Hopeless Boss Fight,0," [Hopeless Boss Fight](/pmwiki/pmwiki.php/Main/HopelessBossFight): The first one. Vincent, however, gets the help of Shelke/ (SPOILER) Lucrecia  to match him.",/pmwiki/pmwiki.php/Main/HopelessBossFight
../data/FinalFantasy/FFVII/,Final Fantasy VII,Weiss the Immaculate,Weiss the Immaculate,A Lighter Shade of Black,0," [A Lighter Shade of Black](/pmwiki/pmwiki.php/Main/ALighterShadeOfBlack): Believe it or not, but Weiss is more or less this when compared to Restrictor. While Weiss is as tyrannical and violent as Restrictor and is not above manipulating people as his pawns to make his revolt successful, the online mode portrays him as a slightly better option as at the very least, he doesn't slaughter people as easily as Restrictor (who basically kills anyone on sight under a whim). Weiss also seems to value the other Tsviets well enough to work with them. Weiss also seems to care enough about freeing the others in Deepground to one extent, while Restrictor just cares about himself.<ul>
-   He and Nero are also considered as this again during  (SPOILER) the final battle against Weiss/Hojo. While Nero and Weiss still summon Omega and almost destroy the Planet at the result, they are portrayed as a more sympathetic light as they help Vincent defeating Hojo for once and all. </ul>",/pmwiki/pmwiki.php/Main/ALighterShadeOfBlack
../data/FinalFantasy/FFVII/,Final Fantasy VII,Weiss the Immaculate,Weiss the Immaculate,Lightning Bruiser,0, [Lightning Bruiser](/pmwiki/pmwiki.php/Main/LightningBruiser): Both muscular and very fast.,/pmwiki/pmwiki.php/Main/LightningBruiser
../data/FinalFantasy/FFVII/,Final Fantasy VII,Weiss the Immaculate,Weiss the Immaculate,Living Emotional Crutch,0, [Living Emotional Crutch](/pmwiki/pmwiki.php/Main/LivingEmotionalCrutch): Implied to be one to Nero. Though *Opera Omnia* also implies that Nero is one for him as he feels incomplete without him and is not even sure to carry out the plan without his help.,/pmwiki/pmwiki.php/Main/LivingEmotionalCrutch
../data/FinalFantasy/FFVII/,Final Fantasy VII,Weiss the Immaculate,Weiss the Immaculate,Meaningful Name,0," [Meaningful Name](/pmwiki/pmwiki.php/Main/MeaningfulName): ""Weiss"" means ""white"" in German, and his subtitle, Immaculate, refers to the Roman Catholic belief of the Immaculate Conception where someone is born completely without the stain of original sin. This both reflects his outfit and  (SPOILER) that Hojo needs a ""pure"" body to serve as Omega's vessel. ",/pmwiki/pmwiki.php/Main/MeaningfulName
../data/FinalFantasy/FFVII/,Final Fantasy VII,Weiss the Immaculate,Weiss the Immaculate,Mix-and-Match Weapon,0, [Mix-and-Match Weapon](/pmwiki/pmwiki.php/Main/MixAndMatchWeapon): Heaven and Earth are a pair of katanas fused to long revolvers.,/pmwiki/pmwiki.php/Main/MixAndMatchWeapon
../data/FinalFantasy/FFVII/,Final Fantasy VII,Weiss the Immaculate,Weiss the Immaculate,Morality Pet,0," [Morality Pet](/pmwiki/pmwiki.php/Main/MoralityPet): Downplayed since his existence drives most of Nero's villainy. But let's say that without him, Nero wouldn't be far from being a complete monster on his own.",/pmwiki/pmwiki.php/Main/MoralityPet
../data/FinalFantasy/FFVII/,Final Fantasy VII,Weiss the Immaculate,Weiss the Immaculate,Omnicidal Maniac,0," [Omnicidal Maniac](/pmwiki/pmwiki.php/Main/OmnicidalManiac): His plan is to take control of Omega and use it to gather all the Lifestream to him. Making sure the Lifestream is as potent and pure as possible demands the death of the planet's citizens.  (SPOILER)  At least it is Hojo's plan. Once freed of his influence, Weiss still carries out the plan but doesn't care about the purity of Omega. He just wants to be free with Nero and fly away together even if it causes the end of the Planet. ",/pmwiki/pmwiki.php/Main/OmnicidalManiac
../data/FinalFantasy/FFVII/,Final Fantasy VII,Weiss the Immaculate,Weiss the Immaculate,One-Handed Zweihänder,0," [One-Handed Zweihänder](/pmwiki/pmwiki.php/Main/OneHandedZweihander): After losing his trademark gunblades in the second-to-last chapter, Weiss fights Vincent with a *nodachi* in each hand.",/pmwiki/pmwiki.php/Main/OneHandedZweihander
../data/FinalFantasy/FFVII/,Final Fantasy VII,Weiss the Immaculate,Weiss the Immaculate,One-Winged Angel,0, [One-Winged Angel](/pmwiki/pmwiki.php/Main/OneWingedAngel): Merges with  (SPOILER) Omega to become Omega Weiss  for the final boss battle.,/pmwiki/pmwiki.php/Main/OneWingedAngel
../data/FinalFantasy/FFVII/,Final Fantasy VII,Weiss the Immaculate,Weiss the Immaculate,Pet the Dog,0," [Pet the Dog](/pmwiki/pmwiki.php/Main/PetTheDog): Has some. Even though he  (SPOILER) tried to recruit Genesis to help him in his rebellion, Genesis is shown having left Deepground. In any case, Weiss probably let him go. <ul>
-   He is apparently the only being who never treated Nero like a monster.  (SPOILER) When the two fuse together, Weiss, being himself again after Hojo's defeat, shows nothing but kindness and affection toward him and is okay to die along with Nero if it means both of them would be together. </ul>",/pmwiki/pmwiki.php/Main/PetTheDog
