folder,game,VGDCName,TvTName,tropeName,subverted,tropeNotes,tropeURL
../data/FinalFantasy/FFVII/,Final Fantasy VII,Cait Sith,Cait Sith,"Welcome Back, Traitor",0," [Welcome Back, Traitor](/pmwiki/pmwiki.php/Main/WelcomeBackTraitor): When they initially find out what he really is, they initially keep him around because Reeve is holding Marlene hostage. Shortly after he performs a [Heroic Sacrifice](/pmwiki/pmwiki.php/Main/HeroicSacrifice) at the Temple of the Ancients to get them the Black Materia, earning their trust for real.",/pmwiki/pmwiki.php/Main/WelcomeBackTraitor
../data/FinalFantasy/FFVII/,Final Fantasy VII,Cait Sith,Cait Sith,"What the Hell, Hero?",0," [What the Hell, Hero?](/pmwiki/pmwiki.php/Main/WhatTheHellHero): Calls out Barret for his bombing missions from earlier in the game. It comes off as somewhat hypocritical, however, since he's... y'know, with the Shinra, but Reeve was never crazy about the killing of innocents to begin with.",/pmwiki/pmwiki.php/Main/WhatTheHellHero
../data/FinalFantasy/FFVII/,Final Fantasy VII,Vincent,Vincent Valentine,11th-Hour Superpower,0," [11th-Hour Superpower](/pmwiki/pmwiki.php/Main/EleventhHourSuperpower): Though Chaos is Vincent's ultimate Limit Break and must be obtained through a sidequest, it becomes this in *Dirge of Cerberus*.  (SPOILER)  After struggling with involuntary transformations into the being and realizing its true purpose, he manages to control it at the climax of the game and fights the final battle in his Chaos state. It boasts the highest possible attack damage and HP stats in the gameplay. ",/pmwiki/pmwiki.php/Main/EleventhHourSuperpower
../data/FinalFantasy/FFVII/,Final Fantasy VII,Vincent,Vincent Valentine,'90s Anti-Hero,0," ['90s Anti-Hero](/pmwiki/pmwiki.php/Main/NinetiesAntiHero): To an arguably bigger extent than Cloud. Vincent is clad in black leather; is brooding, angsty and mysterious; wields all sorts of cool and oversized guns; can turn into horror genre monsters- most notably a demon- and is even depicted in official artwork perched atop a rooftop at night like if he was [The Cowl](/pmwiki/pmwiki.php/Main/TheCowl). *Dirge of Cerberus* solidified these aspects already present in the original game.",/pmwiki/pmwiki.php/Main/NinetiesAntiHero
../data/FinalFantasy/FFVII/,Final Fantasy VII,Vincent,Vincent Valentine,'90s Hair,0, ['90s Hair](/pmwiki/pmwiki.php/Main/NinetiesHair): Back in his days as a Turk Vincent is sporting the side curtains.,/pmwiki/pmwiki.php/Main/NinetiesHair
../data/FinalFantasy/FFVII/,Final Fantasy VII,Vincent,Vincent Valentine,Alliterative Name,0, [Alliterative Name](/pmwiki/pmwiki.php/Main/AlliterativeName): **V**incent **V**alentine.,/pmwiki/pmwiki.php/Main/AlliterativeName
../data/FinalFantasy/FFVII/,Final Fantasy VII,Vincent,Vincent Valentine,Aloof Ally,0," [Aloof Ally](/pmwiki/pmwiki.php/Main/AloofAlly): Though he canonically joined the heroes in the original game, Vincent started acting on his own by the time of *Advent Children* and tends to appear only in key moments to help his allies and then going back to working alone. It continues in *Dirge of Cerberus* as the other heroes work together off-screen as Vincent fights Deepground by himself.",/pmwiki/pmwiki.php/Main/AloofAlly
../data/FinalFantasy/FFVII/,Final Fantasy VII,Vincent,Vincent Valentine,Anti Anti Christ,0," [Anti Anti Christ](/pmwiki/pmwiki.php/Main/AntiAntiChrist): Vincent's Chaos form exists for the specific purpose of killing all living beings to send all Livestream to Omega Weapon so that it heads off into space to find another planet to colonize. Instead it becomes one of mankind's greatest defenders thanks to Vincent, and, ultimately and ironically, the one who stops Omega Weapon from leaving the Planet, saving the world from being destroyed.",/pmwiki/pmwiki.php/Main/AntiAntiChrist
../data/FinalFantasy/FFVII/,Final Fantasy VII,Vincent,Vincent Valentine,Anti-Hero,0," [Anti-Hero](/pmwiki/pmwiki.php/Main/AntiHero): He's shouldering a lot of guilt and is cold and stoic, but he's a good person beneath it and fights for what's right.",/pmwiki/pmwiki.php/Main/AntiHero
../data/FinalFantasy/FFVII/,Final Fantasy VII,Vincent,Vincent Valentine,The Atoner,0, [The Atoner](/pmwiki/pmwiki.php/Main/TheAtoner): He fights to redeem himself for his failure to stop Hojo's experiments.,/pmwiki/pmwiki.php/Main/TheAtoner
../data/FinalFantasy/FFVII/,Final Fantasy VII,Vincent,Vincent Valentine,Badass Cape,0, [Badass Cape](/pmwiki/pmwiki.php/Main/BadassCape): His iconic red mantle that he wears over his shoulders.,/pmwiki/pmwiki.php/Main/BadassCape
../data/FinalFantasy/FFVII/,Final Fantasy VII,Vincent,Vincent Valentine,Badass in a Nice Suit,0, [Badass in a Nice Suit](/pmwiki/pmwiki.php/Main/BadassInANiceSuit): Back in his days as a Turk Vincent wore a snazzy professional suit and was already a proficient gunslinger.,/pmwiki/pmwiki.php/Main/BadassInANiceSuit
../data/FinalFantasy/FFVII/,Final Fantasy VII,Vincent,Vincent Valentine,"Bad Powers, Good People",0," [Bad Powers, Good People](/pmwiki/pmwiki.php/Main/BadPowersGoodPeople): Vincent's ability to transform into monstrous creatures isn't one usually associated with heroes. Even more so when he morphs into Chaos, who is supposed to be a harbinger of death to the planet. Still, Vincent is one of the heroes.",/pmwiki/pmwiki.php/Main/BadPowersGoodPeople
../data/FinalFantasy/FFVII/,Final Fantasy VII,Vincent,Vincent Valentine,The Berserker,0," [The Berserker](/pmwiki/pmwiki.php/Main/TheBerserker): When he enters his transformations as his Limit Breaks, he becomes uncontrollable for the rest of the battle and attacks until all enemies are dead.",/pmwiki/pmwiki.php/Main/TheBerserker
../data/FinalFantasy/FFVII/,Final Fantasy VII,Vincent,Vincent Valentine,BFG,0," [BFG](/pmwiki/pmwiki.php/Main/BFG): His main weapon and most notably his ""Cerberus"", a massive Tri-barrelled revolver.",/pmwiki/pmwiki.php/Main/BFG
../data/FinalFantasy/FFVII/,Final Fantasy VII,Vincent,Vincent Valentine,Breakout Character,0," [Breakout Character](/pmwiki/pmwiki.php/Main/BreakoutCharacter): Despite having some of the lowest stats in the game, he has become one of the most popular characters in the series. He was even popular enough to star in his own spinoff title.",/pmwiki/pmwiki.php/Main/BreakoutCharacter
../data/FinalFantasy/FFVII/,Final Fantasy VII,Vincent,Vincent Valentine,Byronic Hero,0," [Byronic Hero](/pmwiki/pmwiki.php/Main/ByronicHero): Attractive? Check. Intelligent and passionate? Check. [Self-flagellating](/pmwiki/pmwiki.php/Main/ItsAllMyFault) and self-absorbed over a tragic [Dark and Troubled Past](/pmwiki/pmwiki.php/Main/DarkAndTroubledPast) in which he fell from grace and failed [the woman he loved from afar](/pmwiki/pmwiki.php/Main/TheLostLenore) whom he can never forget or move on from or forgive himself over, but which motivates him to an iconoclastic and sometimes self-destructive vendetta against the institutions that wronged him, regardless of the personal costs and risks it entails? Check, check, *check*.",/pmwiki/pmwiki.php/Main/ByronicHero
../data/FinalFantasy/FFVII/,Final Fantasy VII,Vincent,Vincent Valentine,Commonality Connection,0, [Commonality Connection](/pmwiki/pmwiki.php/Main/CommonalityConnection): He becomes close with Red XIII in *On a Way to a Smile* because of their shared long lifespans and fear of outliving their loved ones. They even agree to meet annually in Midgar.,/pmwiki/pmwiki.php/Main/CommonalityConnection
../data/FinalFantasy/FFVII/,Final Fantasy VII,Vincent,Vincent Valentine,Cross Attack,0," [Cross Attack](/pmwiki/pmwiki.php/Main/CrossAttack): In *Dirge of Cerberus*, Vincent can adorn his handguns with cross-shaped pendants such as the Power Cross item.  (SPOILER)  When transforming into Chaos at the climax, Vincent wields two long revolvers with cross-shaped *barrels.*. ",/pmwiki/pmwiki.php/Main/CrossAttack
../data/FinalFantasy/FFVII/,Final Fantasy VII,Vincent,Vincent Valentine,Cutscene Power to the Max,0," [Cutscene Power to the Max](/pmwiki/pmwiki.php/Main/CutscenePowerToTheMax): In *[Dirge of Cerberus](/pmwiki/pmwiki.php/VideoGame/DirgeOfCerberus)*, Vincent pulls off amazing feats of [Gun Fu](/pmwiki/pmwiki.php/Main/GunFu), [Supernatural Martial Arts](/pmwiki/pmwiki.php/Main/SupernaturalMartialArts), and gravity-defying superhuman agility that would make [Dante](/pmwiki/pmwiki.php/VideoGame/DevilMayCry) jealous. But only in cutscenes; when you're controlling him, he can't do any of these things, and in fact, he can barely jump.",/pmwiki/pmwiki.php/Main/CutscenePowerToTheMax
../data/FinalFantasy/FFVII/,Final Fantasy VII,Vincent,Vincent Valentine,Dark and Troubled Past,0," [Dark and Troubled Past](/pmwiki/pmwiki.php/Main/DarkAndTroubledPast): To put it mildly. Vincent's past directly connects him to the creation of Sephiroth, something he blames himself for letting happen at Hojo's hands.",/pmwiki/pmwiki.php/Main/DarkAndTroubledPast
../data/FinalFantasy/FFVII/,Final Fantasy VII,Vincent,Vincent Valentine,Dark Is Not Evil,0," [Dark Is Not Evil](/pmwiki/pmwiki.php/Main/DarkIsNotEvil): He is dark-haired, clad in black leather, associated with the occult and the supernatural... but firmly well-meaning and righteous. This extends towards Chaos, his demonic and [Superpowered Evil Side](/pmwiki/pmwiki.php/Main/SuperpoweredEvilSide) who is actually  (SPOILER)  a creation of the planet meant to be an accessory to the [Godzilla Threshold](/pmwiki/pmwiki.php/Main/GodzillaThreshold) that is Omega .",/pmwiki/pmwiki.php/Main/DarkIsNotEvil
../data/FinalFantasy/FFVII/,Final Fantasy VII,Vincent,Vincent Valentine,Dual Wielding,0, [Dual Wielding](/pmwiki/pmwiki.php/Main/DualWielding):  (SPOILER)  When he transforms into Chaos at the climax of *Dirge of Cerberus* he dual-wields a transformed version of the Death Penalty. It's only instance in the entire *Compilation* in which Vincent wields two guns. ,/pmwiki/pmwiki.php/Main/DualWielding
../data/FinalFantasy/FFVII/,Final Fantasy VII,Vincent,Vincent Valentine,Eerie Pale-Skinned Brunette,0," [Eerie Pale-Skinned Brunette](/pmwiki/pmwiki.php/Main/EeriePaleSkinnedBrunette): Vincent is very quiet and mysterious, and looks plain unsettling.",/pmwiki/pmwiki.php/Main/EeriePaleSkinnedBrunette
../data/FinalFantasy/FFVII/,Final Fantasy VII,Vincent,Vincent Valentine,Firing One-Handed,0," [Firing One-Handed](/pmwiki/pmwiki.php/Main/FiringOneHanded): All of his weapons work this way, even the rifles!",/pmwiki/pmwiki.php/Main/FiringOneHanded
../data/FinalFantasy/FFVII/,Final Fantasy VII,Vincent,Vincent Valentine,Frankenstein's Monster,0," [Frankenstein's Monster](/pmwiki/pmwiki.php/Main/FrankensteinsMonster): His Death Gigas Limit Break, which attacks with [Livewire](/pmwiki/pmwiki.php/Main/ShockAndAwe) and Gigadunk.",/pmwiki/pmwiki.php/Main/FrankensteinsMonster
../data/FinalFantasy/FFVII/,Final Fantasy VII,Vincent,Vincent Valentine,Full-Name Basis,0, [Full-Name Basis](/pmwiki/pmwiki.php/Main/FullNameBasis): And odd recipient of the trope in *Dirge of Cerberus*. Even among his closest allies there are those who only refer to him by his full name.,/pmwiki/pmwiki.php/Main/FullNameBasis
../data/FinalFantasy/FFVII/,Final Fantasy VII,Vincent,Vincent Valentine,Glowing Eyes of Doom,0, [Glowing Eyes of Doom](/pmwiki/pmwiki.php/Main/GlowingEyesOfDoom): *Dirge of Cerberus* shows that his natural crimson eyes glow bright red whenever he is about to transform into Chaos.,/pmwiki/pmwiki.php/Main/GlowingEyesOfDoom
../data/FinalFantasy/FFVII/,Final Fantasy VII,Vincent,Vincent Valentine,Guest Fighter,0, [Guest Fighter](/pmwiki/pmwiki.php/Main/GuestFighter): Cameos as a fighter in *[Ehrgeiz](/pmwiki/pmwiki.php/VideoGame/Ehrgeiz)*.,/pmwiki/pmwiki.php/Main/GuestFighter
../data/FinalFantasy/FFVII/,Final Fantasy VII,Vincent,Vincent Valentine,Gun Fu,0, [Gun Fu](/pmwiki/pmwiki.php/Main/GunFu): The spin-offs have established him utilizing this with his handguns.,/pmwiki/pmwiki.php/Main/GunFu
../data/FinalFantasy/FFVII/,Final Fantasy VII,Vincent,Vincent Valentine,Guns Are Worthless,1," [Guns Are Worthless](/pmwiki/pmwiki.php/Main/GunsAreWorthless): Subverted in the original game. His guns aren't very useful when he uses them to shoot enemies thanks to his low attack, but when he uses them to focus his magic they're very handy indeed, since his magic stat is much better.",/pmwiki/pmwiki.php/Main/GunsAreWorthless
../data/FinalFantasy/FFVII/,Final Fantasy VII,Vincent,Vincent Valentine,The Gunslinger,0," [The Gunslinger](/pmwiki/pmwiki.php/Main/TheGunslinger): In *Dirge Of Cerberus*, he fights with a variety of firearms and is a crack shot with all of them.",/pmwiki/pmwiki.php/Main/TheGunslinger
../data/FinalFantasy/FFVII/,Final Fantasy VII,Vincent,Vincent Valentine,Heroic RRoD,0," [Heroic RRoD](/pmwiki/pmwiki.php/Main/HeroicRROD): In *Dirge Of Cerberus*, Chaos is now not just one of Vincent's Limit Breaks but the most powerful of them, being a WEAPON in its own right. As such, while he can use the Galian Limit Break with no cost to the player he either collapses or is momentarily weakened after using Chaos during cutscenes, up until  (SPOILER)  the end of the game when he gains more control over Chaos and the player controls Vincent in Chaos form .",/pmwiki/pmwiki.php/Main/HeroicRROD
../data/FinalFantasy/FFVII/,Final Fantasy VII,Vincent,Vincent Valentine,Hero of Another Story,0, [Hero of Another Story](/pmwiki/pmwiki.php/Main/HeroOfAnotherStory): Vincent is the main protagonist of the [Spin-Off](/pmwiki/pmwiki.php/Main/SpinOff) sequel *[Dirge of Cerberus](/pmwiki/pmwiki.php/VideoGame/DirgeOfCerberus)*.,/pmwiki/pmwiki.php/Main/HeroOfAnotherStory
../data/FinalFantasy/FFVII/,Final Fantasy VII,Vincent,Vincent Valentine,Hockey Mask and Chainsaw,0," [Hockey Mask and Chainsaw](/pmwiki/pmwiki.php/Main/HockeyMaskAndChainsaw): His Limit Break Hellmasker, with the attacks [Splattercombo](/pmwiki/pmwiki.php/Main/ChainsawGood) and [Nightmare](/pmwiki/pmwiki.php/Main/StatusInflictionAttack).",/pmwiki/pmwiki.php/Main/HockeyMaskAndChainsaw
../data/FinalFantasy/FFVII/,Final Fantasy VII,Vincent,Vincent Valentine,Iconic Outfit,0, [Iconic Outfit](/pmwiki/pmwiki.php/Main/IconicOutfit): His red cowl is easily recognizable among the fandom and he is never seen without it.,/pmwiki/pmwiki.php/Main/IconicOutfit
../data/FinalFantasy/FFVII/,Final Fantasy VII,Vincent,Vincent Valentine,Ineffectual Loner,0," [Ineffectual Loner](/pmwiki/pmwiki.php/Main/IneffectualLoner): As cool as Vincent is, he keeps to himself thanks to his troubled past and naturally quiet nature.",/pmwiki/pmwiki.php/Main/IneffectualLoner
../data/FinalFantasy/FFVII/,Final Fantasy VII,Vincent,Vincent Valentine,It's All My Fault,0, [It's All My Fault](/pmwiki/pmwiki.php/Main/ItsAllMyFault): He blames himself for Hojo's experiments with his and Lucrecia's own child. Vincent being shot and also submitted to the scientist's experiments is also something that he blames himself for.  (SPOILER)  He forgives himself at the end of *Dirge of Cerberus*. ,/pmwiki/pmwiki.php/Main/ItsAllMyFault
../data/FinalFantasy/FFVII/,Final Fantasy VII,Vincent,Vincent Valentine,Legendary in the Sequel,0," [Legendary in the Sequel](/pmwiki/pmwiki.php/Main/LegendaryInTheSequel): In the original game, he was a [Secret Character](/pmwiki/pmwiki.php/Main/SecretCharacter) largely unknown to the world, having spent decades sleeping in a coffin. By *Dirge of Cerberus*, however, he is recognized and spoken to in awe and respect by WRO soldiers.",/pmwiki/pmwiki.php/Main/LegendaryInTheSequel
../data/FinalFantasy/FFVII/,Final Fantasy VII,Vincent,Vincent Valentine,Limited Wardrobe,0," [Limited Wardrobe](/pmwiki/pmwiki.php/Main/LimitedWardrobe): Outside of flashbacks during his Turks days, Vincent is always wearing his aforementioned [Iconic Outfit](/pmwiki/pmwiki.php/Main/IconicOutfit). <img class=""trivia1 rounded"" src=""/images/article-hreficon-trivia.png"" title=""This example contains a TRIVIA entry. It should be moved to the TRIVIA tab.""/>[Word of God](/pmwiki/pmwiki.php/Main/WordOfGod) confirmed they did this intentionally in *Advent Children*, as they felt that him changing outfits as the others had would conflict with his personality.",/pmwiki/pmwiki.php/Main/LimitedWardrobe
../data/FinalFantasy/FFVII/,Final Fantasy VII,Vincent,Vincent Valentine,Loners Are Freaks,0, [Loners Are Freaks](/pmwiki/pmwiki.php/Main/LonersAreFreaks): He's naturally antisocial and keeps to himself.,/pmwiki/pmwiki.php/Main/LonersAreFreaks
../data/FinalFantasy/FFVII/,Final Fantasy VII,Vincent,Vincent Valentine,Long-Haired Pretty Boy,0," [Long-Haired Pretty Boy](/pmwiki/pmwiki.php/Main/LongHairedPrettyBoy): His hair reaches his back and is the resident [Tall, Dark, and Snarky](/pmwiki/pmwiki.php/Main/TallDarkAndSnarky). He's very popular with female fans, too.",/pmwiki/pmwiki.php/Main/LongHairedPrettyBoy
../data/FinalFantasy/FFVII/,Final Fantasy VII,Vincent,Vincent Valentine,Love Hurts,0," [Love Hurts](/pmwiki/pmwiki.php/Main/LoveHurts): He fell in love with Lucrecia, who happened to be in a relationship with [Hojo](/pmwiki/pmwiki.php/Main/MadScientist). When Vincent protested Hojo using their child in his experiments, it got him a bullet in the gut for his trouble, and he became an experiment himself.",/pmwiki/pmwiki.php/Main/LoveHurts
../data/FinalFantasy/FFVII/,Final Fantasy VII,Vincent,Vincent Valentine,Mage Marksman,0," [Mage Marksman](/pmwiki/pmwiki.php/Main/MageMarksman): In *Dirge of Cerberus* he can fire magic bullets by equipping different materia to his gun. In the original game, Vincent displays good affinity with magic overall.",/pmwiki/pmwiki.php/Main/MageMarksman
../data/FinalFantasy/FFVII/,Final Fantasy VII,Vincent,Vincent Valentine,Master of None,0, [Master of None](/pmwiki/pmwiki.php/Main/MasterOfNone): He had fairly lackluster stats in the original game.,/pmwiki/pmwiki.php/Main/MasterOfNone
../data/FinalFantasy/FFVII/,Final Fantasy VII,Vincent,Vincent Valentine,Meaningful Name,0, [Meaningful Name](/pmwiki/pmwiki.php/Main/MeaningfulName): His name hints to his tragic past and unrequited romance.,/pmwiki/pmwiki.php/Main/MeaningfulName
../data/FinalFantasy/FFVII/,Final Fantasy VII,Vincent,Vincent Valentine,My Greatest Failure,0, [My Greatest Failure](/pmwiki/pmwiki.php/Main/MyGreatestFailure): He blames himself for all that happened to him and Lucrecia following her and Hojo's experiments with her child. Vincent regrets not doing more to convince Lucrecia of refusing to follow through with them.,/pmwiki/pmwiki.php/Main/MyGreatestFailure
../data/FinalFantasy/FFVII/,Final Fantasy VII,Vincent,Vincent Valentine,Ninja Pirate Zombie Robot,0," [Ninja Pirate Zombie Robot](/pmwiki/pmwiki.php/Main/NinjaPirateZombieRobot): He looks and acts like a ninja vampire, and can shapeshift into [Captain Ersatz](/pmwiki/pmwiki.php/Main/CaptainErsatz) forms of famous movie monsters, namely Frankenstein's Monster, the Wolfman, and Jason Vorheez.",/pmwiki/pmwiki.php/Main/NinjaPirateZombieRobot
../data/FinalFantasy/FFVII/,Final Fantasy VII,Vincent,Vincent Valentine,Odd Friendship,0," [Odd Friendship](/pmwiki/pmwiki.php/Main/OddFriendship): With Yuffie. Despite polar-opposite personalities, they get along well.",/pmwiki/pmwiki.php/Main/OddFriendship
../data/FinalFantasy/FFVII/,Final Fantasy VII,Vincent,Vincent Valentine,Older Than They Look,0," [Older Than They Look](/pmwiki/pmwiki.php/Main/OlderThanTheyLook): Physically, he looks about 27, but he's chronologically in his early to mid 50s after sealing himself in a coffin.",/pmwiki/pmwiki.php/Main/OlderThanTheyLook
../data/FinalFantasy/FFVII/,Final Fantasy VII,Vincent,Vincent Valentine,One-Winged Angel,0," [One-Winged Angel](/pmwiki/pmwiki.php/Main/OneWingedAngel): In *Dirge of Cerberus*, he gains control over his transformations and becomes Chaos for the final battle.",/pmwiki/pmwiki.php/Main/OneWingedAngel
../data/FinalFantasy/FFVII/,Final Fantasy VII,Vincent,Vincent Valentine,Optional Party Member,0," [Optional Party Member](/pmwiki/pmwiki.php/Main/OptionalPartyMember): You can skip recruiting him in *VII*, but official canon establishes he did join the party.",/pmwiki/pmwiki.php/Main/OptionalPartyMember
../data/FinalFantasy/FFVII/,Final Fantasy VII,Vincent,Vincent Valentine,Our Demons Are Different,0, [Our Demons Are Different](/pmwiki/pmwiki.php/Main/OurDemonsAreDifferent): His Chaos form is a giant black and red winged demon. In *VII* it's his ultimate Limit Break and attacks with [Chaos Saber](/pmwiki/pmwiki.php/Main/RazorWings) and Satan Slam. *Dirge of Cerberus* expanded it into Vincent's [Superpowered Evil Side](/pmwiki/pmwiki.php/Main/SuperpoweredEvilSide) that Lucrecia had forced upon him to save his life.,/pmwiki/pmwiki.php/Main/OurDemonsAreDifferent
../data/FinalFantasy/FFVII/,Final Fantasy VII,Vincent,Vincent Valentine,Our Werewolves Are Different,0," [Our Werewolves Are Different](/pmwiki/pmwiki.php/Main/OurWerewolvesAreDifferent): Invoked by his bestial Galian Beast form, which attacks with [Berserk Dance](/pmwiki/pmwiki.php/Main/RapidfireFisticuffs) and [Beast Flare](/pmwiki/pmwiki.php/Main/PlayingWithFire).",/pmwiki/pmwiki.php/Main/OurWerewolvesAreDifferent
../data/FinalFantasy/FFVII/,Final Fantasy VII,Vincent,Vincent Valentine,Power Floats,0," [Power Floats](/pmwiki/pmwiki.php/Main/PowerFloats): As Chaos, he never stands on the ground, preferring to hover above it. In *Dirge of Cerberus*, it can only fly and float above surfaces.",/pmwiki/pmwiki.php/Main/PowerFloats
../data/FinalFantasy/FFVII/,Final Fantasy VII,Vincent,Vincent Valentine,Power Incontinence,0," [Power Incontinence](/pmwiki/pmwiki.php/Main/PowerIncontinence):  (SPOILER)  When the Protomateria is removed from him in *Dirge of Cerberus*, he suffers from bouts of uncontrollable morphing into Chaos. Only at the climax Vincent manages to control his ultimate form. ",/pmwiki/pmwiki.php/Main/PowerIncontinence
../data/FinalFantasy/FFVII/,Final Fantasy VII,Vincent,Vincent Valentine,Power Limiter,0," [Power Limiter](/pmwiki/pmwiki.php/Main/PowerLimiter):  (SPOILER)  *Dirge of Cerberus* reveals he keeps his transformations under control due to the Protomateria inserted inside him by Lucrecia. When Rosso steals it from Vincent, he struggles with involuntary instances of morphing into Chaos. ",/pmwiki/pmwiki.php/Main/PowerLimiter
../data/FinalFantasy/FFVII/,Final Fantasy VII,Vincent,Vincent Valentine,Red and Black and Evil All Over,0," [Red and Black and Evil All Over](/pmwiki/pmwiki.php/Main/RedAndBlackAndEvilAllOver): [Played With](/pmwiki/pmwiki.php/Main/PlayedWith) in regards to Chaos, who is his [Superpowered Evil Side](/pmwiki/pmwiki.php/Main/SuperpoweredEvilSide) and a dark demon with red in his wings to boot. However, Vincent uses his Chaos form to stand against the villains. [Averted](/pmwiki/pmwiki.php/Main/AvertedTrope) with his standard form, being a well-meaning anti-hero clad in black leather and wearing a red cape.",/pmwiki/pmwiki.php/Main/RedAndBlackAndEvilAllOver
../data/FinalFantasy/FFVII/,Final Fantasy VII,Vincent,Vincent Valentine,"Red Eyes, Take Warning",0," [Red Eyes, Take Warning](/pmwiki/pmwiki.php/Main/RedEyesTakeWarning): Has crimson eyes. His human model for *Dirge of Cerberus* reveals it's their natural color.",/pmwiki/pmwiki.php/Main/RedEyesTakeWarning
../data/FinalFantasy/FFVII/,Final Fantasy VII,Vincent,Vincent Valentine,Red Is Heroic,0," [Red Is Heroic](/pmwiki/pmwiki.php/Main/RedIsHeroic): Wears a red [Badass Cape](/pmwiki/pmwiki.php/Main/BadassCape) and is one of the good guys, [despite his cold demeanor](/pmwiki/pmwiki.php/Main/AntiHero).",/pmwiki/pmwiki.php/Main/RedIsHeroic
../data/FinalFantasy/FFVII/,Final Fantasy VII,Vincent,Vincent Valentine,Revolvers Are Just Better,0," [Revolvers Are Just Better](/pmwiki/pmwiki.php/Main/RevolversAreJustBetter): Some of his weapons, most notably the Peacemaker.",/pmwiki/pmwiki.php/Main/RevolversAreJustBetter
../data/FinalFantasy/FFVII/,Final Fantasy VII,Vincent,Vincent Valentine,Sawed-Off Shotgun,0," [Sawed-Off Shotgun](/pmwiki/pmwiki.php/Main/SawedOffShotgun): 1/3 of Vincent's weapons are shotguns, one even [being named ""Shotgun""](/pmwiki/pmwiki.php/Main/ExactlywhatItSaysOnTheTin).",/pmwiki/pmwiki.php/Main/SawedOffShotgun
../data/FinalFantasy/FFVII/,Final Fantasy VII,Vincent,Vincent Valentine,Sealed Good in a Can,0," [Sealed Good in a Can](/pmwiki/pmwiki.php/Main/SealedGoodInACan): After Hojo was done experimenting on him, Vincent was horrified by what he had become and went to sleep in a coffin in Shinra Manor for years.",/pmwiki/pmwiki.php/Main/SealedGoodInACan
../data/FinalFantasy/FFVII/,Final Fantasy VII,Vincent,Vincent Valentine,Secret Character,0, [Secret Character](/pmwiki/pmwiki.php/Main/SecretCharacter): Finding him requires a short sidequest to reveal him.,/pmwiki/pmwiki.php/Main/SecretCharacter
../data/FinalFantasy/FFVII/,Final Fantasy VII,Vincent,Vincent Valentine,Shadow Archetype,0," [Shadow Archetype](/pmwiki/pmwiki.php/Main/ShadowArchetype): A heroic version but nonetheless he fits. A brooding loner haunted by the loss of a woman he loved at the hands of his arch-enemy? Vincent is what Cloud might become if he doesn't learn to cope with his issues. <img class=""trivia1 rounded"" src=""/images/article-hreficon-trivia.png"" title=""This example contains a TRIVIA entry. It should be moved to the TRIVIA tab.""/>[Word of God](/pmwiki/pmwiki.php/Main/WordOfGod) shares this viewpoint.",/pmwiki/pmwiki.php/Main/ShadowArchetype
