folder,game,VGDCName,TvTName,tropeName,subverted,tropeNotes,tropeURL
../data/FinalFantasy/FFVII/,Final Fantasy VII,Reno,Reno,Characterization Marches On,0," [Characterization Marches On](/pmwiki/pmwiki.php/Main/CharacterizationMarchesOn): Reno was a competent [Deadpan Snarker](/pmwiki/pmwiki.php/Main/DeadpanSnarker) in the original game. In *Advent Children*, he became the [Plucky Comic Relief](/pmwiki/pmwiki.php/Main/PluckyComicRelief). There have been reports, though, that the [Deadpan Snarker](/pmwiki/pmwiki.php/Main/DeadpanSnarker) version of him was an alteration of the translation and that he was supposed to have been comical in the original Japanese. According to [this<img height=""12"" src=""https://static.tvtropes.org/pmwiki/pub/external_link.gif"" style=""border:none;"" width=""12""/>](http://forums.qhimm.com/index.php?topic=19279.0), Reno's personality in the JP version of FF7 was in the middle between the localization (which lost much of his charm) and the Compilation (which played up his silliness). He was playful and laidback but still took his job seriously (with his career as a Turk being just a job as far as he cares).",/pmwiki/pmwiki.php/Main/CharacterizationMarchesOn
../data/FinalFantasy/FFVII/,Final Fantasy VII,Reno,Reno,Character Tic,0," [Character Tic](/pmwiki/pmwiki.php/Main/CharacterTic): Sticking his tongue out, particularly in installments after the original game.",/pmwiki/pmwiki.php/Main/CharacterTic
../data/FinalFantasy/FFVII/,Final Fantasy VII,Reno,Reno,Deadpan Snarker,0, [Deadpan Snarker](/pmwiki/pmwiki.php/Main/DeadpanSnarker): Reno is very sarcastic and snarky.,/pmwiki/pmwiki.php/Main/DeadpanSnarker
../data/FinalFantasy/FFVII/,Final Fantasy VII,Reno,Reno,Evil Redhead,0," [Evil Redhead](/pmwiki/pmwiki.php/Main/EvilRedhead): Reno, but only in the original game. In other appearances, he's more an [Anti-Villain](/pmwiki/pmwiki.php/Main/AntiVillain) than straight evil.",/pmwiki/pmwiki.php/Main/EvilRedhead
../data/FinalFantasy/FFVII/,Final Fantasy VII,Reno,Reno,Fiery Redhead,0," [Fiery Redhead](/pmwiki/pmwiki.php/Main/FieryRedhead): Reno could be considered a male example, being very spry and talkative.",/pmwiki/pmwiki.php/Main/FieryRedhead
../data/FinalFantasy/FFVII/,Final Fantasy VII,Reno,Reno,Hair Color Dissonance,0," [Hair Color Dissonance](/pmwiki/pmwiki.php/Main/HairColorDissonance): His [official artwork<img height=""12"" src=""https://static.tvtropes.org/pmwiki/pub/external_link.gif"" style=""border:none;"" width=""12""/>](https://imgur.com/a/sgGPdUU), [in-game battle model<img height=""12"" src=""https://static.tvtropes.org/pmwiki/pub/external_link.gif"" style=""border:none;"" width=""12""/>](https://imgur.com/a/nEy011A), and media beyond the original game depict him with having bright red hair while his [overworld model<img height=""12"" src=""https://static.tvtropes.org/pmwiki/pub/external_link.gif"" style=""border:none;"" width=""12""/>](https://imgur.com/a/PwkXCGP) gives him a less saturated color more similar to brown.",/pmwiki/pmwiki.php/Main/HairColorDissonance
../data/FinalFantasy/FFVII/,Final Fantasy VII,Reno,Reno,Karma Houdini,0," [Karma Houdini](/pmwiki/pmwiki.php/Main/KarmaHoudini): Reno never suffers the consequences for setting off the bomb which destroyed Sector 7 (an act similar to burning down a house to kill one mosquito). Hell, Barret never even remarks about this whenever he meets Reno in person.",/pmwiki/pmwiki.php/Main/KarmaHoudini
../data/FinalFantasy/FFVII/,Final Fantasy VII,Reno,Reno,A Sinister Clue,0," [A Sinister Clue](/pmwiki/pmwiki.php/Main/ASinisterClue): Much like Sephiroth, Reno is left-handed, since that's the hand he holds his stun baton in (he also wears a watch on his right hand.) In-game this is a *literal* clue as you can Steal the Tough Ring accessory from him, last seen in flashback equipped by...Sephiroth.",/pmwiki/pmwiki.php/Main/ASinisterClue
../data/FinalFantasy/FFVII/,Final Fantasy VII,Rude,Rude,All Love Is Unrequited,0," [All Love Is Unrequited](/pmwiki/pmwiki.php/Main/AllLoveIsUnrequited): He has a crush on Tifa, who is both unaware and uninterested. Hilariously if you have Tifa in your party while fighting the Turks, Rude tries to avoid attacking her.",/pmwiki/pmwiki.php/Main/AllLoveIsUnrequited
../data/FinalFantasy/FFVII/,Final Fantasy VII,Rude,Rude,Ambiguously Brown,0," [Ambiguously Brown](/pmwiki/pmwiki.php/Main/AmbiguouslyBrown): Rude, though described by <img class=""trivia1 rounded"" src=""/images/article-hreficon-trivia.png"" title=""This example contains a TRIVIA entry. It should be moved to the TRIVIA tab.""/>[Word of God](/pmwiki/pmwiki.php/Main/WordOfGod) as somewhat resembling a person of South American descent rather than African descent.",/pmwiki/pmwiki.php/Main/AmbiguouslyBrown
../data/FinalFantasy/FFVII/,Final Fantasy VII,Rude,Rude,The Atoner,0," [The Atoner](/pmwiki/pmwiki.php/Main/TheAtoner): Like Reno, Rude becomes this is *Advent Children*. However, this detail is only made clear in the Complete version of the film where the two talk about the Turks' previous role as the ""obliterators"" of the world and how they have a lot they need to atone for while they're still alive.",/pmwiki/pmwiki.php/Main/TheAtoner
../data/FinalFantasy/FFVII/,Final Fantasy VII,Rude,Rude,Bald of Evil,0, [Bald of Evil](/pmwiki/pmwiki.php/Main/BaldOfEvil): Rude hasn't got a hair on his head.,/pmwiki/pmwiki.php/Main/BaldOfEvil
../data/FinalFantasy/FFVII/,Final Fantasy VII,Rude,Rude,Barefisted Monk,0, [Barefisted Monk](/pmwiki/pmwiki.php/Main/BarefistedMonk): He beats you up with his bare hands.,/pmwiki/pmwiki.php/Main/BarefistedMonk
../data/FinalFantasy/FFVII/,Final Fantasy VII,Rude,Rude,Boss-Altering Consequence,0," [Boss-Altering Consequence](/pmwiki/pmwiki.php/Main/BossAlteringConsequence): If you have Tifa in your party, he will try to avoid fighting her if he can, and if she's the only one standing, his attacks will miss more frequently.",/pmwiki/pmwiki.php/Main/BossAlteringConsequence
../data/FinalFantasy/FFVII/,Final Fantasy VII,Rude,Rude,Cool Shades,0," [Cool Shades](/pmwiki/pmwiki.php/Main/CoolShades): Rude is always shown with his sunglasses. In *Advent Children* we briefly see his eyes when they fall off and Reno steps on them; after a look of horror from Rude, he stands up and [pulls a spare pair from his pocket](/pmwiki/pmwiki.php/Main/UnlikelySpare).",/pmwiki/pmwiki.php/Main/CoolShades
../data/FinalFantasy/FFVII/,Final Fantasy VII,Rude,Rude,Flunky Boss,0, [Flunky Boss](/pmwiki/pmwiki.php/Main/FlunkyBoss): The fight with Rude in Rocket Town has him standing behind two Attack Squad soldiers.,/pmwiki/pmwiki.php/Main/FlunkyBoss
../data/FinalFantasy/FFVII/,Final Fantasy VII,Rude,Rude,Shock and Awe,0," [Shock and Awe](/pmwiki/pmwiki.php/Main/ShockAndAwe): When Rude is fought in Rocket Town and Midgar, he can use an electric attack called Grand Spark.",/pmwiki/pmwiki.php/Main/ShockAndAwe
../data/FinalFantasy/FFVII/,Final Fantasy VII,Elena,Elena,Big Damn Heroes,0," [Big Damn Heroes](/pmwiki/pmwiki.php/Main/BigDamnHeroes): She and Tseng show up in time to save Rufus from falling to his death in *Advent Children*. Later in the film in the *Advent Children Complete* version, she then saves Rude and Reno from a helicopter crash alongside Tseng.",/pmwiki/pmwiki.php/Main/BigDamnHeroes
../data/FinalFantasy/FFVII/,Final Fantasy VII,Elena,Elena,Damsel in Distress,0, [Damsel in Distress](/pmwiki/pmwiki.php/Main/DamselInDistress): Elena gets kidnapped by Don Corneo along with Yuffie in the Wutai sidequest after going off on her own to search for him.,/pmwiki/pmwiki.php/Main/DamselInDistress
../data/FinalFantasy/FFVII/,Final Fantasy VII,Elena,Elena,Dark Action Girl,0," [Dark Action Girl](/pmwiki/pmwiki.php/Main/DarkActionGirl): Elena seems to be the least competent member of the Turks. [However, in the one battle in which you fight her](/pmwiki/pmwiki.php/Main/NotSoHarmlessVillain), she turns out to have more HP than Reno or Rude (said HP can't be scanned), is able to defend herself rather well and can inflict Confusion on your characters.",/pmwiki/pmwiki.php/Main/DarkActionGirl
../data/FinalFantasy/FFVII/,Final Fantasy VII,Elena,Elena,Inconsistent Spelling,0, [Inconsistent Spelling](/pmwiki/pmwiki.php/Main/InconsistentSpelling): Elena's name is actually written as Irina in katakana.,/pmwiki/pmwiki.php/Main/InconsistentSpelling
../data/FinalFantasy/FFVII/,Final Fantasy VII,Elena,Elena,Laser-Guided Karma,0," [Laser-Guided Karma](/pmwiki/pmwiki.php/Main/LaserGuidedKarma): She blames Cloud for Tseng's supposed death, and tries to punch him in Icicle Inn. If Cloud (easily) avoids her pathetic attack, she'll slip and go *falling down a hill out of town*.",/pmwiki/pmwiki.php/Main/LaserGuidedKarma
../data/FinalFantasy/FFVII/,Final Fantasy VII,Elena,Elena,Minion with an F in Evil,0," [Minion with an F in Evil](/pmwiki/pmwiki.php/Main/MinionWithAnFInEvil): Elena is... spectacularly bad at her job sometimes. Her career highlights include blabbing sensitive intel to the enemy instead of just [Evil Gloating](/pmwiki/pmwiki.php/Main/EvilGloating), getting kidnapped by a Z-grade crime boss, (probably) missing a punch so badly she ends up falling down a hill and (potentially) just walking away from a climactic clash with the heroes because she's just not feeling it. Even if she manages to punch Cloud unconscious in Icicle Inn, her immediate response is feeling regretful about it and just leaving him behind to recover rather than apprehending him.",/pmwiki/pmwiki.php/Main/MinionWithAnFInEvil
../data/FinalFantasy/FFVII/,Final Fantasy VII,Elena,Elena,More Deadly Than the Male,0," [More Deadly Than the Male](/pmwiki/pmwiki.php/Main/MoreDeadlyThanTheMale): Despite her bumbling newbie track record at eveything else, in battle she absolutely clowns both Rude and Reno in terms of strength and competence.",/pmwiki/pmwiki.php/Main/MoreDeadlyThanTheMale
../data/FinalFantasy/FFVII/,Final Fantasy VII,Elena,Elena,New Meat,0," [New Meat](/pmwiki/pmwiki.php/Main/NewMeat): With the Turks being bled down to just Tseng, Rude, and Reno after *Before Crisis*, Elena is recruited early in *Final Fantasy VII* to bolster their numbers. And boy does it show.",/pmwiki/pmwiki.php/Main/NewMeat
../data/FinalFantasy/FFVII/,Final Fantasy VII,Elena,Elena,Only Sane Man,0," [Only Sane Man](/pmwiki/pmwiki.php/Main/OnlySaneMan): While the original game leans heavily into her being a bumbling new recruit, she's still significantly smarter and more mature than Rude and Reno generally are",/pmwiki/pmwiki.php/Main/OnlySaneMan
../data/FinalFantasy/FFVII/,Final Fantasy VII,Elena,Elena,Playing with Fire,0," [Playing with Fire](/pmwiki/pmwiki.php/Main/PlayingWithFire): The one time Elena is fought, she can use a fire attack on the team.",/pmwiki/pmwiki.php/Main/PlayingWithFire
../data/FinalFantasy/FFVII/,Final Fantasy VII,Elena,Elena,Sibling Rivalry,0," [Sibling Rivalry](/pmwiki/pmwiki.php/Main/SiblingRivalry): *Before Crisis* reveals that Elena's older sister was a Turk, and Elena resented her for outperforming her; she refused to join the Turks while her sister was a member. She joined after her sister retired along with many other Turks from that game, following their defeat of Zirconiade and decision to follow Veld's lead.",/pmwiki/pmwiki.php/Main/SiblingRivalry
../data/FinalFantasy/FFVII/,Final Fantasy VII,Elena,Elena,The Smurfette Principle,0," [The Smurfette Principle](/pmwiki/pmwiki.php/Main/TheSmurfettePrinciple): Elena is the female of the four. Averted with the *Compilation* establishing there were more female Turks in the past, her sister being one of them.",/pmwiki/pmwiki.php/Main/TheSmurfettePrinciple
../data/FinalFantasy/FFVII/,Final Fantasy VII,Elena,Elena,Throw Down the Bomblet,0, [Throw Down the Bomblet](/pmwiki/pmwiki.php/Main/ThrowDownTheBomblet): Her weapon is thrown explosives..,/pmwiki/pmwiki.php/Main/ThrowDownTheBomblet
../data/FinalFantasy/FFVII/,Final Fantasy VII,Cissnei,Cissnei,All Love Is Unrequited,0," [All Love Is Unrequited](/pmwiki/pmwiki.php/Main/AllLoveIsUnrequited): It's implied that she falls for Zack sometime during the story. Shortly after she met him, however, Zack fell from Mako Reactor 5 to meet Aerith, who he formed an instant connection with and started dating shortly after.",/pmwiki/pmwiki.php/Main/AllLoveIsUnrequited
../data/FinalFantasy/FFVII/,Final Fantasy VII,Cissnei,Cissnei,Ascended Extra,0," [Ascended Extra](/pmwiki/pmwiki.php/Main/AscendedExtra): ""Shuriken (Female)"" was just one of several generic Turks the player could choose to play as in *Before Crisis*. *Crisis Core* gave Cissnei an actual name and a prominent story role.",/pmwiki/pmwiki.php/Main/AscendedExtra
../data/FinalFantasy/FFVII/,Final Fantasy VII,Cissnei,Cissnei,Canon Name,0," [Canon Name](/pmwiki/pmwiki.php/Main/CanonName): Averted. Cissnei straight up tells Zack that ""Cissnei"" is *not* her real name. Meaning whatever the player named her in *Before Crisis* is just as valid as her *Crisis Core* codename.",/pmwiki/pmwiki.php/Main/CanonName
../data/FinalFantasy/FFVII/,Final Fantasy VII,Cissnei,Cissnei,Fangirl,0," [Fangirl](/pmwiki/pmwiki.php/Main/Fangirl): It's heavily implied in ''Crisis Core Final Fantasy VII Reunion"" that she started and runs his online fan club.",/pmwiki/pmwiki.php/Main/Fangirl
../data/FinalFantasy/FFVII/,Final Fantasy VII,Cissnei,Cissnei,Fuuma Shuriken,0, [Fuuma Shuriken](/pmwiki/pmwiki.php/Main/FuumaShuriken): Cissnei fights with an oversized red shuriken.,/pmwiki/pmwiki.php/Main/FuumaShuriken
../data/FinalFantasy/FFVII/,Final Fantasy VII,Cissnei,Cissnei,Improbable Age,0," [Improbable Age](/pmwiki/pmwiki.php/Main/ImprobableAge): Zack notes she's very young, even by Turk standards. She explains this is due to her being raised inside the company to be a Turk since she was very little.",/pmwiki/pmwiki.php/Main/ImprobableAge
../data/FinalFantasy/FFVII/,Final Fantasy VII,Cissnei,Cissnei,Irony,0," [Irony](/pmwiki/pmwiki.php/Main/Irony): She defies orders to retrieve Zack and Cloud on the shores near the Nibel Plains, thinking she's helping rescue them from Shinra. Quite the contrary, the Turks were trying to rescue the two of them from the Shinra Army as well, and her letting them go ultimately resulted in Zack meeting said Army face to face.",/pmwiki/pmwiki.php/Main/Irony
../data/FinalFantasy/FFVII/,Final Fantasy VII,Cissnei,Cissnei,Ms. Fanservice,0," [Ms. Fanservice](/pmwiki/pmwiki.php/Main/MsFanservice): In *Crisis Core* where her suit is form-fitting, she's often flirtatious with Zack and she gets a gratuitous [beach scenes at Costa Del Sol](/pmwiki/pmwiki.php/Main/BeachEpisode) showing off her well-toned stomach in a bathing suit.",/pmwiki/pmwiki.php/Main/MsFanservice
../data/FinalFantasy/FFVII/,Final Fantasy VII,Cissnei,Cissnei,The Paranoiac,0," [The Paranoiac](/pmwiki/pmwiki.php/Main/TheParanoiac): Apparently Cissnei, or otherwise known as Shuriken in Before Crisis, thought everyone was after her due to being raised in the Turks from childhood. Her training encouraged this mindset and it took her colleagues helping her to abandon it.",/pmwiki/pmwiki.php/Main/TheParanoiac
../data/FinalFantasy/FFVII/,Final Fantasy VII,Cissnei,Cissnei,Pet the Dog,0," [Pet the Dog](/pmwiki/pmwiki.php/Main/PetTheDog): She looks the other way so Zack can escape being a test subject with Cloud (the latter of whom is visibly suffering from severe Mako addiction), lies to Tseng to give them a better chance of getting away, and even gives him the keys to a motorcycle (complete with sidecar, so Cloud won't be at risk of falling off in his catatonic state).",/pmwiki/pmwiki.php/Main/PetTheDog
../data/FinalFantasy/FFVII/,Final Fantasy VII,Cissnei,Cissnei,Tyke Bomb,0," [Tyke Bomb](/pmwiki/pmwiki.php/Main/TykeBomb): She was an orphan who was ""adopted"" by the Turks so they could raise her to be one of them from an early age, which is why she has no family of her own.",/pmwiki/pmwiki.php/Main/TykeBomb
../data/FinalFantasy/FFVII/,Final Fantasy VII,Cissnei,Cissnei,Unwitting Instigator of Doom,0," [Unwitting Instigator of Doom](/pmwiki/pmwiki.php/Main/UnwittingInstigatorOfDoom): Her ways of trying to help Zack get a head start and escape the Turks are entirely successful. Too bad this also means that when the Turks are eventually looking to find Zack and Cloud to save them instead, [they fail](/pmwiki/pmwiki.php/Main/GoneHorriblyRight) — which lets Zack stumble into the horde of Shinra troopers that sealed his fate.",/pmwiki/pmwiki.php/Main/UnwittingInstigatorOfDoom
../data/FinalFantasy/FFVII/,Final Fantasy VII,Gast Faramis,Gast Faramis,All There in the Manual,0," [All There in the Manual](/pmwiki/pmwiki.php/Main/AllThereInTheManual): His last name is never given in the game proper, and wasn't revealed until years later in the 10th Anniversary Ultimania.",/pmwiki/pmwiki.php/Main/AllThereInTheManual
../data/FinalFantasy/FFVII/,Final Fantasy VII,Gast Faramis,Gast Faramis,Always Someone Better,0," [Always Someone Better](/pmwiki/pmwiki.php/Main/AlwaysSomeoneBetter): He's this to Hojo; most in Shinra are open in their consideration that as brilliant as Hojo is, he's nothing compared to Gast.",/pmwiki/pmwiki.php/Main/AlwaysSomeoneBetter
../data/FinalFantasy/FFVII/,Final Fantasy VII,Gast Faramis,Gast Faramis,Disappeared Dad,0, [Disappeared Dad](/pmwiki/pmwiki.php/Main/DisappearedDad): Aerith's. Gast was murdered by Shinra soldiers under Hojo's command when his daughter was twenty days old.,/pmwiki/pmwiki.php/Main/DisappearedDad
../data/FinalFantasy/FFVII/,Final Fantasy VII,Gast Faramis,Gast Faramis,For Science!,0, [For Science!](/pmwiki/pmwiki.php/Main/ForScience): His goal seemed to be a genuine understanding of the Cetra.,/pmwiki/pmwiki.php/Main/ForScience
../data/FinalFantasy/FFVII/,Final Fantasy VII,Gast Faramis,Gast Faramis,Mad Scientist,0, [Mad Scientist](/pmwiki/pmwiki.php/Main/MadScientist): Edged towards it studying Jenova; when he realized what she was he backed off.,/pmwiki/pmwiki.php/Main/MadScientist
../data/FinalFantasy/FFVII/,Final Fantasy VII,Gast Faramis,Gast Faramis,Meaningful Name,0," [Meaningful Name](/pmwiki/pmwiki.php/Main/MeaningfulName): During the 1930s, there was a german scientist called Professor Herman Wirth, who searched for an ancient civilization and a ""mother goddess"" on the north pole. Wirth is derived from the German word Wirt, meaning bartender. Gast is a german word meaning guest, but could also refer to a customer of a Wirt/bartender. Wirth and Gast also look very similar.",/pmwiki/pmwiki.php/Main/MeaningfulName
../data/FinalFantasy/FFVII/,Final Fantasy VII,Gast Faramis,Gast Faramis,"My God, What Have I Done?",0," [My God, What Have I Done?](/pmwiki/pmwiki.php/Main/MyGodWhatHaveIDone): Heavily implied by his reaction when Ifalna tells him about how Jenova originally killed almost all the Cetra, especially when he realizes that Shinra extracted her cells to create Sephiroth.",/pmwiki/pmwiki.php/Main/MyGodWhatHaveIDone
../data/FinalFantasy/FFVII/,Final Fantasy VII,Gast Faramis,Gast Faramis,"Screw This, I'm Outta Here",0," [Screw This, I'm Outta Here](/pmwiki/pmwiki.php/Main/ScrewThisImOuttaHere): When he found out from Ifalna that Jenova was an [Eldritch Abomination](/pmwiki/pmwiki.php/Main/EldritchAbomination), Gast left Shinra.",/pmwiki/pmwiki.php/Main/ScrewThisImOuttaHere
../data/FinalFantasy/FFVII/,Final Fantasy VII,Gast Faramis,Gast Faramis,Unwitting Instigator of Doom,0," [Unwitting Instigator of Doom](/pmwiki/pmwiki.php/Main/UnwittingInstigatorOfDoom): His discovery of Jenova would lead to the creation of SOLDIER, Sephiroth, and Genesis. Though Gast left the company, it was too late to undo his discoveries.",/pmwiki/pmwiki.php/Main/UnwittingInstigatorOfDoom
../data/FinalFantasy/FFVII/,Final Fantasy VII,Lucrecia,Lucrecia Crescent,Abusive Parents,0, [Abusive Parents](/pmwiki/pmwiki.php/Main/AbusiveParents): *Dirge of Cerberus* makes it completely clear that she fully consented to inject Jenova cells into her unborn child.,/pmwiki/pmwiki.php/Main/AbusiveParents
../data/FinalFantasy/FFVII/,Final Fantasy VII,Lucrecia,Lucrecia Crescent,All Love Is Unrequited,0," [All Love Is Unrequited](/pmwiki/pmwiki.php/Main/AllLoveIsUnrequited): Played with. Vincent fell in love with her and she cared for him too, but Lucrecia was guilty of being involved with the experiment that killed his father and pushed herself away from him and into Hojo's arms.",/pmwiki/pmwiki.php/Main/AllLoveIsUnrequited
../data/FinalFantasy/FFVII/,Final Fantasy VII,Lucrecia,Lucrecia Crescent,And I Must Scream,0," [And I Must Scream](/pmwiki/pmwiki.php/Main/AndIMustScream): She's sealed herself in a cocoon of crystallized Mako out of guilt for her actions, and is unable to die. Whether she can escape or not is unknown, but she doesn't want to as her imprisonment was self-imposed.",/pmwiki/pmwiki.php/Main/AndIMustScream
../data/FinalFantasy/FFVII/,Final Fantasy VII,Lucrecia,Lucrecia Crescent,Apologises a Lot,0," [Apologises a Lot](/pmwiki/pmwiki.php/Main/ApologisesALot): In *Dirge of Cerberus*, nearly every flashback Vincent has of her involves her apologizing for something. Considering the things she's done, it's not hard to understand why.",/pmwiki/pmwiki.php/Main/ApologisesALot
../data/FinalFantasy/FFVII/,Final Fantasy VII,Lucrecia,Lucrecia Crescent,Bitch in Sheep's Clothing,0," [Bitch in Sheep's Clothing](/pmwiki/pmwiki.php/Main/BitchInSheepsClothing): She's soft-spoken, amiable, and [Apologizes a Lot](/pmwiki/pmwiki.php/Main/ApologizesALot)... but she *constantly* hurts Vincent, and she experimented on her own child.",/pmwiki/pmwiki.php/Main/BitchInSheepsClothing
../data/FinalFantasy/FFVII/,Final Fantasy VII,Lucrecia,Lucrecia Crescent,Death Seeker,0," [Death Seeker](/pmwiki/pmwiki.php/Main/DeathSeeker): She wants to die, but thanks to Hojo's experiments cannot. So she decided to do the next ""best"" thing: creating crystallized Mako to encase herself in within a cave.",/pmwiki/pmwiki.php/Main/DeathSeeker
../data/FinalFantasy/FFVII/,Final Fantasy VII,Lucrecia,Lucrecia Crescent,Dirty Coward,0," [Dirty Coward](/pmwiki/pmwiki.php/Main/DirtyCoward): After she refused to admit responsibility for her actions, she sealed herself in a mako crystal in a cave.",/pmwiki/pmwiki.php/Main/DirtyCoward
../data/FinalFantasy/FFVII/,Final Fantasy VII,Lucrecia,Lucrecia Crescent,Guilt Complex,0," [Guilt Complex](/pmwiki/pmwiki.php/Main/GuiltComplex): She first suffers this when gets Grimoire killed when she researches Chaos, then it got worse when she rejects Vincent's attempt to console her and go for the heartless scumbag Hojo. And when she sees her son's future and is horrified by her actions. When her son is taken away from her without being able to hold him, she immediately thinks that her son is dead. And combining it while dealing with the emotional turmoil about Vincent's death makes it turn suicidal.",/pmwiki/pmwiki.php/Main/GuiltComplex
../data/FinalFantasy/FFVII/,Final Fantasy VII,Lucrecia,Lucrecia Crescent,Horrible Judge of Character,0," [Horrible Judge of Character](/pmwiki/pmwiki.php/Main/HorribleJudgeOfCharacter): Everyone who knew Hojo knew he was a scumbag of the highest order, yet Lucrecia was his lover.",/pmwiki/pmwiki.php/Main/HorribleJudgeOfCharacter
../data/FinalFantasy/FFVII/,Final Fantasy VII,Lucrecia,Lucrecia Crescent,I Did What I Had to Do,0, [I Did What I Had to Do](/pmwiki/pmwiki.php/Main/IDidWhatIHadToDo): Her justification for  (SPOILER) implanting the Protomateria into  Vincent; it was the only way to save his life.,/pmwiki/pmwiki.php/Main/IDidWhatIHadToDo
../data/FinalFantasy/FFVII/,Final Fantasy VII,Lucrecia,Lucrecia Crescent,It's All My Fault,0," [It's All My Fault](/pmwiki/pmwiki.php/Main/ItsAllMyFault): She has this attitude... and she's right. Her carelessness gets Grimoire Valentine killed, her actions get Vincent killed and experimented on, and she abuses her own child in utero by injecting him with Jenova cells - which kicks off the whole mess from Nibelheim onwards.",/pmwiki/pmwiki.php/Main/ItsAllMyFault
../data/FinalFantasy/FFVII/,Final Fantasy VII,Lucrecia,Lucrecia Crescent,Labcoat of Science and Medicine,0, [Labcoat of Science and Medicine](/pmwiki/pmwiki.php/Main/LabcoatOfScienceAndMedicine): Her white lab coat for a scientist.,/pmwiki/pmwiki.php/Main/LabcoatOfScienceAndMedicine
../data/FinalFantasy/FFVII/,Final Fantasy VII,Lucrecia,Lucrecia Crescent,Late-Arrival Spoiler,0, [Late-Arrival Spoiler](/pmwiki/pmwiki.php/Main/LateArrivalSpoiler): A major factor in understanding her actions in *Dirge of Cerberus* is that her son is  (SPOILER) Sephiroth . This gives away a reveal from *Final Fantasy VII* that  (SPOILER) Hojo is Sephiroth's father. ,/pmwiki/pmwiki.php/Main/LateArrivalSpoiler
../data/FinalFantasy/FFVII/,Final Fantasy VII,Lucrecia,Lucrecia Crescent,Meaningful Name,0," [Meaningful Name](/pmwiki/pmwiki.php/Main/MeaningfulName): Lucrecia (and its Latin counterpart ""Lucretia"") comes from lucrum, meaning ""wealth"". Lucretia was a mythical Roman figure who was infamously raped by Sextus Tarquinius. This may have been meant to hint at the nature of Lucrecia's forced participation in the Jenova Project in early game designs (when she was named), or it could be meant to emphasize the perverse nature of Sephiroth's conception.",/pmwiki/pmwiki.php/Main/MeaningfulName
../data/FinalFantasy/FFVII/,Final Fantasy VII,Lucrecia,Lucrecia Crescent,"My God, What Have I Done?",0," [My God, What Have I Done?](/pmwiki/pmwiki.php/Main/MyGodWhatHaveIDone): She was horrified when a vision showed her what her child with Hojo would become.",/pmwiki/pmwiki.php/Main/MyGodWhatHaveIDone
